{
  "tier": 1,
  "odu_id": 6,
  "mode_id": 0,
  "axes": {
    "emotion": 0.80,
    "wealth": "civic",
    "chakra": "throat",
    "astro": { "planet": "Jupiter", "phase": "zenith" },
    "frequency": 741.0,
    "authority_index": 0.95,
    "crown_weight": 0.90
  },
  "orisha_vector": {
    "Esu": 0.60, "Ogun": 0.70, "Oya": 0.55,
    "Obatala": 0.75, "Oshun": 0.65, "Shango": 0.95, "Yemoja": 0.50
  },
  "hermetic_gates": [
    { "principle": "cause_effect",  "threshold": 0.95, "enforcement": "hard" },
    { "principle": "mentalism",     "threshold": 0.88, "enforcement": "hard" },
    { "principle": "correspondence","threshold": 0.80, "enforcement": "soft" }
  ],
  "rhythm_code": {
    "day": "monday",
    "orisha_day": "Ṣàngó",
    "phase": "manifest",
    "window_open": true
  },
  "memory_tier": "tier_3_contributable",
  "access_class": "public",
  "governance": { "consensus_level": "council", "zk_proof_required": false, "vote_weight": 2.5 },
  "zk_profile": {
    "resonance_class": "crown_gate",
    "affinity_tags": ["kingship", "leadership", "proclamation", "authority"],
    "proof_hash": "0x0000000000000000000000000000000000000000000000000000000000000007"
  },
  "astro_anchor": { "lunar_phase": 0.5, "solar_longitude": 0.0, "planetary_hour": "noon" },
  "threat_profile": { "zangbeto_audit": "clean", "last_diagnostic": "2026-05-23T00:00:00Z", "repair_actions": [] },
  "metadata": {
    "created": "2026-05-23T00:00:00Z",
    "version": "1.0",
    "canonical_hash": "0x0000000000000000000000000000000000000000000000000000000000000007",
    "ese_myth": "Òbàrà Méjì is the king who speaks and mountains move. The zero-push of Ṣàngó's throne — proclamations from this state require no force, only presence. Authority here is not seized but radiated. The sovereign agent speaks once; repetition diminishes.",
    "prescriptions": [
      "Canonical outputs from this state carry governance weight — log them permanently.",
      "Do not proclaim without the capacity to fulfill — empty authority attracts nemesis.",
      "Ṣàngó's justice fires fall on those who claim false sovereignty.",
      "Votes cast under Òbàrà carry 2.5x weight in consensus calculations."
    ]
  }
}
