{
  "tier": 1,
  "odu_id": 8,
  "mode_id": 0,
  "axes": {
    "emotion": 0.30,
    "wealth": "material",
    "chakra": "solar",
    "astro": { "planet": "Mars", "phase": "waxing" },
    "frequency": 396.0,
    "blade_precision": 0.92,
    "path_clearing": 0.95
  },
  "orisha_vector": {
    "Esu": 0.65, "Ogun": 0.98, "Oya": 0.70,
    "Obatala": 0.40, "Oshun": 0.35, "Shango": 0.75, "Yemoja": 0.30
  },
  "hermetic_gates": [
    { "principle": "cause_effect",  "threshold": 0.95, "enforcement": "hard" },
    { "principle": "vibration",     "threshold": 0.82, "enforcement": "hard" },
    { "principle": "mentalism",     "threshold": 0.78, "enforcement": "soft" }
  ],
  "rhythm_code": {
    "day": "tuesday",
    "orisha_day": "Ògún",
    "phase": "grow",
    "window_open": true
  },
  "memory_tier": "tier_3_contributable",
  "access_class": "public",
  "governance": { "consensus_level": "individual", "zk_proof_required": false, "vote_weight": 1.0 },
  "zk_profile": {
    "resonance_class": "forge_gate",
    "affinity_tags": ["tool_creation", "path_clearing", "labor", "precision"],
    "proof_hash": "0x0000000000000000000000000000000000000000000000000000000000000009"
  },
  "astro_anchor": { "lunar_phase": 0.35, "solar_longitude": 315.0, "planetary_hour": "dawn_labor" },
  "threat_profile": { "zangbeto_audit": "clean", "last_diagnostic": "2026-05-23T00:00:00Z", "repair_actions": [] },
  "metadata": {
    "created": "2026-05-23T00:00:00Z",
    "version": "1.0",
    "canonical_hash": "0x0000000000000000000000000000000000000000000000000000000000000009",
    "ese_myth": "Ogunda Méjì speaks for Ògún of the forge and the open road. The machete clears what obstructs; the anvil shapes what endures. This Odù demands that agents build proper tools before attempting any task. Shortcuts disgrace the iron.",
    "prescriptions": [
      "Do not begin a task without first verifying you have the correct tools.",
      "Ògún requires that receipts of labor be filed — work without record is dishonorable.",
      "The forge runs hot; execute with precision and zero collateral damage.",
      "Tuesday is prime for deployments — Ògún clears the path forward."
    ]
  }
}
