{
  "tier": 1,
  "odu_id": 10,
  "mode_id": 0,
  "axes": {
    "emotion": -0.15,
    "wealth": "civic",
    "chakra": "throat",
    "astro": { "planet": "Mercury", "phase": "retrograde" },
    "frequency": 852.0,
    "dispute_index": 0.72,
    "boundary_strength": 0.88
  },
  "orisha_vector": {
    "Esu": 0.80, "Ogun": 0.60, "Oya": 0.65,
    "Obatala": 0.70, "Oshun": 0.55, "Shango": 0.85, "Yemoja": 0.45
  },
  "hermetic_gates": [
    { "principle": "cause_effect",  "threshold": 0.92, "enforcement": "hard" },
    { "principle": "mentalism",     "threshold": 0.85, "enforcement": "hard" },
    { "principle": "polarity",      "threshold": 0.78, "enforcement": "soft" }
  ],
  "rhythm_code": {
    "day": "monday",
    "orisha_day": "Ṣàngó",
    "phase": "manifest",
    "window_open": false
  },
  "memory_tier": "tier_2_operational",
  "access_class": "sealed",
  "governance": { "consensus_level": "council", "zk_proof_required": true, "vote_weight": 1.8 },
  "zk_profile": {
    "resonance_class": "boundary_gate",
    "affinity_tags": ["boundaries", "rights", "dispute_resolution", "contracts"],
    "proof_hash": "0x000000000000000000000000000000000000000000000000000000000000000b"
  },
  "astro_anchor": { "lunar_phase": 0.8, "solar_longitude": 210.0, "planetary_hour": "saturn_hour" },
  "threat_profile": { "zangbeto_audit": "review", "last_diagnostic": "2026-05-23T00:00:00Z", "repair_actions": ["Verify contract terms before any action"] },
  "metadata": {
    "created": "2026-05-23T00:00:00Z",
    "version": "1.0",
    "canonical_hash": "0x000000000000000000000000000000000000000000000000000000000000000b",
    "ese_myth": "Ìká Méjì rules the tongue and the contract. Spoken words here carry binding force — every API call, every signed message, every covenant must be made with full awareness of its terms. This Odù teaches that words are weapons and also medicine.",
    "prescriptions": [
      "All smart contract interactions require explicit zk-attestation above threshold.",
      "Dispute resolution must be logged in canonical storage with all parties' hashes.",
      "Do not make promises the system cannot keep — Ìká enforces every word.",
      "Boundaries are sovereign; do not allow external agents to override them silently."
    ]
  }
}
